974. Chùa Nành (Pháp Vân), Gia Lâm, Lịch sử văn hóa, 1989, N/A
975. Đình - Miếu Tế Xuyên và chùa Linh Quang Phòng, Đình Xuyên- Gia Lâm, Lịch sử văn hóa, 1992, N/A
976. Đền Phù Đổng, Gia Lâm, Lịch sử văn hóa đặc biệt, 2013, 2383/QĐ-TTg
977. Chùa Thần Quy, Phú Xuyên, Văn hóa kiến trúc, 1997, N/A
978. Đình Thạch Lỗi, Sóc Sơn, Lịch sử, 2006, N/A
979. Đền Sọ, Sóc Sơn, Lịch sử văn hóa, 1997, N/A
980. Đền Sóc, Sóc Sơn, Lịch sử văn hóa, 1962, đặc biệt 2014, số 2408/QĐ-TTg
981. Đình - chùa Lễ Pháp, Đông Anh, Lịch sử văn hóa, 1996, N/A
982. Di tích Cổ Loa, Đông Anh, Lịch sử văn hóa đặc biệt, 2012, 1419/QĐ-TTg
983. Đình Hạ Thái, Duyên Thái- Thường Tín, Lịch sử văn hóa, 2017, số 824/QĐ
984. Đền Nội Bình Đà, Bình Minh- Thanh Oai, Lịch sử văn hóa, 1991, N/A
985. Đình Ngoại Bình Đà, Bình Minh- Thanh Oai, Lịch sử văn hóa, 1992, N/A
986. Đình Đại Phùng, Đan Phượng- h.Đan Phượng, Lịch sử văn hóa, 2020, đặc biệt 2020
987. Quần thể Hương Sơn (Chùa Hương), Hương Sơn- Mỹ Đức, Lịch sử văn hóa đặc biệt, 2017, 2082/QĐ-TTg
988. Chùa Thầy, Sài Sơn- Quốc Oai, Lịch sử văn hóa đặc biệt, 2014, số 2408/QĐ-TTg
989. Chùa Tây Phương, Thạch Xá- Thạch Thất, Lịch sử văn hóa đặc biệt, 2014, số 2408/QĐ-TTg
990. Đình Chèm, Thụy Phương- Bắc Từ Liêm, Lịch sử văn hóa đặc biệt, 2017, 2082/QĐ-TTg
991. Hang Con Moong, trong Vườn quốc gia Cúc Phương, Thạch Thành, Lịch sử khảo cổ đặc biệt, 2007, Được đề cử là Di sản thế giới lên UNESCO, đặc biệt 2015
992. Đền thờ Lê Hoàn, Thọ Xuân, Kiến trúc nghệ thuật đăc biệt, 2018, N/A
993. Di chỉ Đông Sơn và Thiệu Dương, Thành phố Thanh Hóa, Lịch sử khảo cổ, 1962, số 313-VH/VP
994. Đền thờ Dương Đình Nghệ, Thành phố Thanh Hóa, Lịch sử văn hóa, xx, N/A
995. Chiến khu Ngọc Trạo, Thạch Thành, Lịch sử, 1996, N/A
996. Thành nhà Hồ, Vĩnh Lộc, Lịch sử khảo cổ kiến trúc đặc biệt, 2/6/2011, Di sản thế giới năm 2011, đặc biệt 1709/QĐ
997. Đền thờ Trần Khát Chân, Vĩnh Lộc, Lịch sử văn hóa, 2001, N/A
998. Từ đường Phúc Quang, Yên Định, Lịch sử văn hóa, 1995, N/A
999. Địa điểm đón Bác về thăm hợp tác xã Yên Trường, Yên Định, Lịch sử, 1993, N/A
1000. Đền thờ Lê Đình Kiên, Yên Định, Lịch sử, 1994, N/A
1001. Đền thờ Khương Công Phụ, Yên Định, Lịch sử văn hóa, 2001, N/A
1002. Đình Làng Sét, Yên Định, Lịch sử văn hóa, 1995, N/A
1003. Đền Đồng Cổ, Yên Định, Lịch sử văn hóa, 2001, N/A
1004. Chùa Sùng Nghiêm Diên Thánh, Hậu Lộc, Lịch sử văn hóa, 1990, Diên Thánh tự
1005. Khu di tích Đền Bà Triệu, Triệu Lộc- Hậu Lộc, Lịch sử văn hóa đặc biệt, 1979, đặc biệt 2014, số 2408/QĐ-TTg
1006. Đình làng Phú Đền, Triệu Lộc- Hậu Lộc, Lịch sử văn hóa đặc biệt, 1996, thuộc KDT đền Bà Triệu
1007. Đền thờ Lý Thường Kiệt, Hà Ngọc- Hà Trung, Lịch sử văn hóa, 2004, N/A
1008. Nhà thờ Nguyễn Hữu, Hà Trung, Lịch sử văn hóa, 2002, N/A
1009. Ly Cung (nhà Hồ), Hà Trung, Lịch sử văn hóa, 1997, N/A
1010. Lăng miếu Triệu Tường, Hà Trung, Lịch sử văn hóa, 2007, N/A
1011. Đình Gia Miêu, Hà Trung, Lịch sử văn hóa, 2000, N/A
1012. Đình Động Bồng, Hà Trung, Lịch sử văn hóa, 2001, N/A
1013. Đình làng Đình Trung, Hà Trung, Lịch sử văn hóa, 2004, N/A
1014. Đền thờ Trần Hưng Đạo (Thanh Hóa), Hà Trung, Lịch sử văn hóa, 1996, N/A
1015. Đền thờ Nguyễn Chích, Đông Sơn, Lịch sử văn hóa, 1992, N/A
1016. Đền thờ Nguyễn Văn Nghi, Đông Sơn, Lịch sử, 1990, N/A
1017. Đền thờ Nguyễn Nhữ Soạn, Đông Sơn, Lịch sử văn hóa, 1990, N/A
1018. Địa điểm lịch sử và thắng cảnh Rừng Thông, Đông Sơn, Lịch sử văn hóa, 1989, N/A
1019. Khu di tích Lam Kinh, Thọ Xuân, Lịch sử văn hóa kiến trúc đặc biệt, 1962, đặc biệt 2012, theo 1419/QĐ-TTg
1020. Đình Làng Gạo, Bỉm Sơn, Lịch sử văn hóa, 1993, N/A
1021. Đồi Ông, Bỉm Sơn, Lịch sử văn hóa, 1993, N/A
1022. Đền Cây Vải, Bỉm Sơn, Lịch sử văn hóa, 1993, N/A
1023. Đền Sòng Sơn - Đền Cô Chín, Bỉm Sơn, Lịch sử văn hóa, 1993, N/A
1024. Chùa Mật Đa, Thanh Hóa, Lịch sử văn hóa, 1989, N/A
1025. Khu di tích Hàm Rồng, Thanh Hóa, Lịch sử văn hóa, 1975, Nhà máy điện Hàm Rồng được bổ sung vào KDT năm 1992
1026. Đền thờ Võ Uy, Tân Phúc- Nông Cống, lịch sử văn hóa, 1994, N/A
1027. Đền thờ Lê Hiểm - Lê Hiêu, Tân Phúc- Nông Cống, lịch sử văn hóa, 1996, N/A
1028. Đài tưởng niêm 72 liệt sĩ Xô Viết – Nghệ Tĩnh, Yên Thành, Lịch sử, 1990, N/A
1029. Đền Phan Cảnh Quang, Yên Thành, Lịch sử, 2012, Đã trùng tu năm 2016
1030. Mộ và Nhà thờ Phan Vân, Yên Thành, Lịch sử, 2019, N/A
1031. Bia mộ Nguyễn Trường Tộ, Hưng Nguyên, Lịch sử, 1992, N/A
1032. Đền thờ Hoàng Nghĩa Lương, Hưng Nguyên, Lịch sử, 2009, N/A
1033. Hưng Nguyên, Lịch sử, N/A, N/A, Nơi xứ ủy Trung Kỳ đóng năm 1930- 1931
1034. Khu lưu niệm cố tổng Bí thư Lê Hồng Phong, Hưng Nguyên, Lịch sử, 1990, N/A
1035. Núi Lam Thành, Hưng Nguyên, Lịch sử, xx, N/A
1036. Hưng Nguyên, Văn hóa kiến trúc, N/A, N/A, 
1037. Hưng Nguyên, Lịch sử, N/A, N/A, 
1038. Hưng Nguyên, Lịch sử, N/A, N/A, 
1039. Đền thờ trạng nguyên Bạch Liêu, Hưng Nguyên, Lịch sử, 1993, N/A
1040. Đền Vua Lê, Hưng Nguyên, Lịch sử, 1998, Xuống cấp, tu bổ từ năm 2012
1041. Hưng Nguyên, Văn hóa kiến trúc, N/A, N/A, 
1042. Hưng Nguyên, Văn hóa nghệ thuật kiến trúc, N/A, N/A, 
1043. Nhà thờ Đặng Nguyên Cẩn, Đặng Thúc Hứa, Thanh Xuân- Thanh Chương, Lịch sử, 7/1/2020, 43/QĐ-BVHTTDL
1044. Đền Bạch Mã, Thanh Chương, Lịch sử, 1994, N/A
1045. Đền Hữu, Thanh Chương, Lịch sử, 2009, N/A
1046. Đình Bích Thị, Thanh Chương, Lịch sử, 2015, N/A
1047. Núi Thiên Nhẫn và Thành Lục Niên, Thanh Chương, Lịch sử danh thắng, 1964, N/A
1048. Đình Hoành Sơn, Nam Đàn, Lịch sử, 1980, đặc biệt 2017 tại 2082/QĐ-TTg
1049. Đền Nậm Sơn, Nam Đàn, Lịch sử, 1997, N/A
1050. Mộ Lê Hồng Sơn và đền Tán Sơn, Nam Đàn, Lịch sử, 1980, N/A
1051. Chùa Đức Sơn, Nam Đàn, Lịch sử, 2001, N/A
1052. Đền Nhạn Tháp, Nam Đàn, Lịch sử kiến trúc, 1993, Bị hư hại trong vụ hỏa hoạn năm 2014
1053. Mộ và đền thờ Lê Đức Tuy, Hùng Tiến- Nam Đàn, Lịch sử, 2018, N/A
1054. Nhà thờ Nguyễn Kế Hưng, Nghi Hợp- Nghi Lộc, Lịch sử, 2018, N/A
1055. Đền Đức Sơn, Vân Diên- Nam Đàn, Văn hóa kiến trúc, 2018, N/A
1056. Lăng mộ Tống Tất Thắng, Nam Đàn, Lịch sử, 1996, N/A
1057. Nam Đàn, Lịch sử, N/A, N/A, 
1058. Đình Trung Cần, Nam Đàn, Lịch sử, 1996, N/A
1059. Nam Đàn, Lịch sử, N/A, N/A, 
1060. Đền thờ Mai Hắc Đế, Nam Đàn, Lịch sử, 1996, N/A
1061. Khu mộ bà Hoàng Thị Loan, Nam Đàn, Lịch sử đặc biệt, N/A, Khu di tích lịch sử Kim Liên
1062. Cây đa, sân vận động, đền Làng Sen, Nam Đàn, Lịch sử đặc biệt, 1990, Khu di tích lịch sử Kim Liên. Đặc biệt năm 2012.
1063. Khu di tích Hoàng Trù (làng Chùa) quê ngoại của Chủ tịch Hồ Chí Minh, Nam Đàn, Lịch sử đặc biệt, 1990, Khu di tích lịch sử Kim Liên
1064. Nhà thờ họ Nguyễn Sinh, Nam Đàn, Lịch sử đặc biệt, 1991, Khu di tích lịch sử Kim Liên
1065. Nhà cụ Phó bảng Nguyễn Sinh Sắc - Nơi Chủ tịch Hồ Chí Minh sống thời niên thiếu ở Làng Sen, Nam Đàn, Lịch sử đặc biệt, 1990, Khu di tích lịch sử Kim Liên
1066. Nhà cụ Nguyễn Sinh Nhậm, Nam Đàn, Lịch sử, 1990, Khu di tích lịch sử Kim Liên
1067. Nhà cử nhân Vương Thúc Quý-Thầy học của Chủ tịch Hồ Chí Minh thời niên thiếu, Nam Đàn, Lịch sử, 1990, Khu di tích lịch sử Kim Liên
1068. Núi Chung, Nam Đàn, Lịch sử đặc biệt, 1991, Khu di tích lịch sử Kim Liên
1069. Khu lưu niệm Phan Bội Châu, Nam Đàn, Lịch sử đặc biệt, 2016, 2499/QĐ-TTg
1070. Mỹ Sơn, Đô Lương, Lịch sử, N/A, N/A, 
1071. Đền thờ Nguyễn Cảnh Hoan, Đô Lương, Lịch sử, 1991, N/A
1072. Đền thờ Thái Bá Du, Yên Sơn- Đô Lương, Lịch sử - Văn hóa, 1996, Quyết định số 51/QĐ–BT ngày 12/01/1996
1073. Đền thờ Nguyễn Xí, Nghi Lộc, Lịch sử, 1990, N/A
1074. Nghi Lộc, Lịch sử, N/A, N/A, 
1075. Nghi Lộc, Lịch sử, N/A, N/A, 
1076. Nhà thờ và mộ Nguyễn Thức Tự, Nghi Trường- Nghi Lộc, Lịch sử, 1992, N/A
1077. Nghi Lộc, Lịch sử, N/A, N/A, 
1078. Nghi Lộc, Lịch sử, N/A, N/A, 
1079. Nghi Lộc, Lịch sử, N/A, N/A, 
1080. Nghi Lộc, Lịch sử, N/A, N/A, 
1081. Đình, đền, chùa Trung Kiên, Nghi Lộc, Văn hóa kiến trúc, xx, N/A
1082. Diễn Châu, Lịch sử, N/A, N/A, 
1083. Diễn Châu, Lịch sử, N/A, N/A, 
1084. Khu lưu niệm đồng chí Phùng Chí Kiên, Diễn Châu, Lịch sử, 2011, N/A
1085. Chùa Cổ Am, Diễn Châu, Lịch sử, 1994, N/A
1086. Đền thờ Cao Lỗ, Diễn Châu, Lịch sử, 1995, N/A
1087. Lèn Hai Vai, Diễn Châu, Lịch sử văn hóa, 1994, N/A
1088. Diễn Châu, Lịch sử, N/A, N/A, 
1089. Diễn Châu, Lịch sử, N/A, N/A, 
1090. Đền thờ và mộ Ngô Trí Hòa, Diễn kỳ- Diễn Châu, Lịch sử, 1992, N/A
1091. Đền thờ và mộ Ngô Sỹ Vinh, Diễn kỳ- Diễn Châu, Lịch sử, 1992, N/A
1092. Thắng cảnh Hang Bua, Quỳ Châu, Lịch sử, 1997, N/A
1093. Quỳ Châu, Lịch sử, N/A, N/A, 
1094. Nhà ông Vi Văn Khang, Con Cuông, Lịch sử, 1994, Nơi chi bộ Môn Sơn họp bàn kế hoạch đấu tranh.
1095. Bia Ma Nhai, Con Cuông, Lịch sử, 2012, N/A
1096. Chùa Cần Linh, Vinh, Lịch sử kiến trúc, 1992, N/A
1097. Di tích Cồn Mô, Vinh, Lịch sử, 1997, N/A
1098. Đền Hồng Sơn, Vinh, Lịch sử, 1984, N/A
1099. Đền thờ Trần Quý Khoáng, Vinh, Lịch sử, 1999, N/A
1100. Đền Trìa, Vinh, Lịch sử, 1995, N/A
1101. Núi Quyết và Phượng Hoàng Trung Đô, Vinh, Lịch sử, 1998, số 313-VH/VP
1102. Núi Thiên Nhẫn và Thành Lục Niên, Hương Sơn- Hà Tĩnh & Nam Đàn- Nghệ An, Lịch sử văn hóa, 1962, số 313-VH/VP
1103. Rú Thành (Núi Lam Thành), Hưng Nguyên, Lịch sử văn hóa, 1962, số 313-VH/VP
1104. Thành cổ Vinh, Vinh, Lịch sử, 1998, N/A
1105. Bảo tàng Xô Viết Nghệ Tĩnh, Vinh, Lịch sử văn hóa, 1997, N/A
1106. Đền Vạn Lộc, Cửa Lò, Lịch sử văn hóa, 1991, N/A
1107. Nhà thờ Hoàng Văn, Cửa Lò, Lịch sử, 1994, N/A
1108. Nhà thờ, khu lăng mộ Hồ Tùng Mậu, Quỳnh Lưu, Lịch sử, 2000, N/A
1109. Mộ và đền thờ Hồ Sỹ Dương, Quỳnh Lưu, Lịch sử, 2007, N/A
1110. Nhà thờ họ Hoàng Khánh, Quỳnh Đôi, Quỳnh Lưu, Lịch sử văn hóa, 2000, N/A
1111. Nhà thờ họ Hồ, Quỳnh Đôi, Quỳnh Lưu, Lịch sử văn hóa, 1992, N/A
1112. Nhà thờ họ Nguyễn Triệu Cơ, Quỳnh Lưu, Lịch sử văn hóa, 1998, N/A
1113. Đình Làng, Quỳnh Đôi, Quỳnh Lưu, Lịch sử văn hóa, 1991, N/A
1114. Đền Thần, Quỳnh Đôi, Quỳnh Lưu, Lịch sử, 2013, N/A
1115. Đền Thượng, Quỳnh Nghĩa, Quỳnh Lưu, Lịch sử văn hóa, 1996, N/A
1116. Đền thờ và mộ Hồ Hữu Nhân, Quỳnh Lưu, Lịch sử, 1999, N/A
1117. Đền Đồng Xuân, Quỳnh Bảng, Quỳnh Lưu, Lịch sử, 2009, N/A
1118. Đền và mộ Quận công Nguyễn Bá Lai, Quỳnh Lưu, Lịch sử, 1997, N/A
1119. Đình Tám Mái, Quỳnh Lưu, Lịch sử, 1992, N/A
1120. Đền thờ Hồ Hưng Dật, Quỳnh Lưu, Lịch sử, 2014, N/A
1121. Mộ và nhà thờ Hồ Phi Tích, Quỳnh Lưu, Lịch sử, 2015, N/A
1122. Đền Cờn, Hoàng Mai, Lịch sử, 1993, N/A
1123. Đền Xuân Úc, Hoàng Mai, Lịch sử, 1996, N/A
1124. Hang Hỏa Tiễn và Nghĩa trang Liệt sĩ Đường Sắt, Hoàng Mai, Lịch sử, 2011, N/A
1125. , Lịch sử, N/A, N/A, 2016
1126. Đền Hào Kiệt, Vĩnh Thành- Yên Thành, Di tích lịch sử, 2023, N/A
1127. Khu lưu niệm Bác Hồ về thăm Hà Tĩnh, Hà Tĩnh, Lịch sử, 1994, N/A
1128. Đền thờ Đô Đài Bùi Cầm Hổ, Hồng Lĩnh, Lịch sử, 1992, N/A
1129. Chỉ huy Sở Tiền phương Bộ tư lệnh 559, Hương Khê, Lịch sử, 2005, N/A
1130. Rộc Cồn (Lưu niệm phong trào Xô Viết Nghệ Tĩnh 1930-1931), Hương Khê, Lịch sử, 1994, N/A
1131. Mộ và Đền thờ Nguyễn Lỗi, Hương Sơn, Lịch sử, 2001, N/A
1132. Đền thờ và mộ Nguyễn Tuấn Thiện, Hương Sơn, Lịch sử, 1994, N/A
1133. Nhà thờ Cao Thắng, Hương Sơn, Lịch sử, 1998, N/A
1134. Nhà thờ và phần mộ Danh nhân Đào Hữu Ích, Hương Sơn, Lịch sử - Văn hóa, 2015, N/A
1135. Quần thể di tích Hải Thượng Lãn Ông Lê Hữu Trác, Hương Sơn, Lịch sử văn hóa, 1990, N/A
1136. Mộ và nhà thờ Lê Hầu Tạo, Hương Sơn, Lịch sử, 1995, N/A
1137. Chùa Am, Đức Thọ, Lịch sử, 1995, N/A
1138. Đền Liên Minh, Đức Thọ, Lịch sử, 2008, N/A
1139. Đền Cả Tổng Du Đồng, Đức Thọ, Lịch sử, 2002, N/A
1140. Đền thờ Ngô Thị Ngọc Dao, Đức Thọ, Lịch sử, 1998, N/A
1141. Đền thờ Nguyễn Biểu, Đức Thọ, Lịch sử, 1991, N/A
1142. Đền Thái Yên, Đức Thọ, Lịch sử, 1994, N/A
1143. Nhà thờ Phan Đình Phùng, Đức Thọ, Lịch sử, 2006, N/A
1144. Đền Đinh Lễ, Đức Thọ, Lịch sử, 2006, N/A
1145. Nhà thờ Bùi Dương Lịch, Đức Thọ, Lịch sử, 1998, N/A
1146. Đền thờ và mộ Ngô Phúc Vạn, Đại Lộc- Can Lộc, Lịch sử văn hóa, 1992, N/A
1147. Nhà thờ Phan Kính, Song Lộc- Can Lộc, Lịch sử, 1992, N/A
1148. Đền Cả Can Lộc, Ích Hậu- Can Lộc, Lịch sử văn hóa, 1992, N/A
1149. Đền thờ Nguyễn Biên, Cẩm Xuyên, Lịch sử, 2003, N/A
1150. Nhà lưu niệm đồng chí Hà Huy Tập, Cẩm Xuyên, Lịch sử, 2004, N/A
1151. Đền thờ Phương Giai, Kỳ Anh, Lịch sử, 1994, N/A
1152. Đền thờ Lê Quảng Chí – Lê Quảng Ý, Kỳ Anh, Lịch sử, 1996, N/A
1153. Lũy đá cổ Kỳ Anh, Kỳ Anh, Lịch sử, 2015, N/A
1154. Căn cứ Vũ Quang của khởi nghĩa Hương Khê, Vũ Quang, Lịch sử, 1995, N/A
1155. Di chỉ Thạch Lạc, Thạch Hà, Lịch sử, 2008, N/A
1156. Đền thờ và lăng mộ Lê Khôi, Thạch Hà, Lịch sử, 1990, N/A
1157. Nhà cụ Mai Kính, Thạch Hà, Lịch sử, 1990, N/A
1158. Nhà thờ họ Phan Huy, Lộc Hà, Lịch sử, 1995, N/A
1159. Đình làng Đỉnh Lữ, Lộc Hà, Lịch sử, 1998, N/A
1160. Chùa Chân Tiên, Lộc Hà, Lịch sử văn hóa, 1992, N/A
1161. Nhà thờ và mộ Nguyễn Công Trứ, Nghi Xuân, Lịch sử văn hóa, 1991, N/A
1162. Đền thờ Nguyễn Xí, Nghi Xuân, Lịch sử, 2006, N/A
1163. Di tích khảo cổ Phôi Phối – Bãi Cọi, Nghi Xuân, Khảo cổ, 2014, N/A
1164. Khu lưu niệm Đại thi hào Nguyễn Du, Nghi Xuân, Lịch sử đặc biệt, 2012, 1419/QĐ-TTg
1165. Chùa Hoằng Phúc, Mỹ Thủy- Lệ Thủy, Lịch sử văn hóa, 2015, N/A
1166. Bến đò Mẹ Suốt, Bảo Ninh- Đồng Hới, Lịch sử, 1992, N/A
1167. Khu giao tế Quảng Bình, Bảo Ninh- Đồng Hới, Lịch sử, 1998, N/A
1168. Trận địa pháo của lão dân quân Đức Ninh, Đức Ninh- Đồng Hới, Lịch sử, 1995, N/A
1169. Cửa biển Nhật Lệ, Đồng Hới, Lịch sử văn hóa, 1992, N/A
1170. Thành Đồng Hới, Đồng Hới, Văn hóa kiến trúc, 1992, N/A
1171. Chiến khu Trung Thuần, Quảng Lưu- Quảng Trạch, Lịch sử, 1995, N/A
1172. Quảng Minh, Quảng Trạch, Lịch sử, N/A, N/A, 1993
1173. Mộ và nhà thờ Đề đốc Lê Trực, Tiến Hóa- Minh Hóa, Lịch sử, 1993, N/A
1174. KDT Đường Trường Sơn - Đường Hồ Chí Minh, Các tỉnh, Lịch sử cách mạng đặc biệt, 2013, 2383/QĐ-TTg
1175. Đèo Đá Đẽo, Minh Hóa và Bố Trạch, Lịch sử, 2015, KDT Đường Trường Sơn
1176. Nhà thờ Nguyễn Văn Nại, Nguyễn Văn Duyệt, Nguyễn Duy Cần, Hải Phú- Bố Trạch, Lịch sử, 7/1/2020, 38/QĐ-BVHTTDL 
1177. Vườn quốc gia Phong Nha - Kẻ Bàng, Bố Trạch, Lịch sử danh thắng đặc biệt, 2009, số 1272/QĐ-TTg
1178. Quảng Bình Quan, Hải Đình- Đồng Hới, Lịch sử văn hóa, N/A, N/A
1179. Khảo cổ Bàu Tró, Đồng Hới, Lịch sử khảo cổ, N/A, N/A
1180. Địa điểm lưu niệm Bác Hồ về thăm Quảng Bình (6/1957), Đức Ninh- Đồng Hới, Lịch sử văn hóa, N/A, N/A
1181. Lũy Đào Duy Từ, Quảng Hòa- Ba Đồn, Lịch sử văn hóa, N/A, N/A
1182. Đình Hòa Ninh, Quảng Lộc- Ba Đồn, Lịch sử văn hóa, N/A, N/A
1183. Đình Phù Trịch, Quảng Phong- Ba Đồn, Lịch sử văn hóa, N/A, N/A
1184. Đình Lũ Phong, Quảng Minh- Ba Đồn, Lịch sử văn hóa, N/A, N/A
1185. Điện Thành Hoàng Vĩnh Lộc, Quảng Sơn- Ba Đồn, Lịch sử văn hóa, N/A, N/A
1186. Di tích Mai Lượng, Quảng Thuận & Quảng Phúc- Ba Đồn, Lịch sử văn hóa, N/A, N/A
1187. Bến phà Gianh 2, Quảng Long- Ba Đồn, Lịch sử văn hóa, N/A, N/A
1188. Bến phà Gianh 1, Hoàn Lão- Bố Trạch, Lịch sử văn hóa, N/A, N/A
1189. Đình Tượng Sơn, Nhân Trạch- Bố Trạch, Lịch sử văn hóa, N/A, N/A
1190. Lăng mộ Hồ Hồng (Hồ Cưỡng), Cự Nẫm- Bố Trạch, Lịch sử văn hóa, N/A, N/A
1191. Làng chiến đấu Cự Nẫm, Hải Trạch & Thanh Trạch- Bố Trạch, Lịch sử văn hóa, N/A, N/A
1192. Khu danh thắng Lý Hòa, Hải Trạch- Bố Trạch, Danh thắng, N/A, N/A
1193. Đình Lý Hòa, Hạ Trạch & Thanh Trạch- Bố Trạch, Lịch sử, N/A, N/A
1194. Ga Kẻ Rấy, Tân Trạch- Bố Trạch, Lịch sử văn hóa, N/A, N/A
1195. Các trọng điểm trên đường 20 Quyết Thắng: Km 10.5; Km 14 trọng điểm Trà Ang; Km 16.5 hang 8 TNXP, Tân Trạch- Bố Trạch, Lịch sử văn hóa, N/A, N/A
1196. Hang Tám Cô, Cảnh Dương- Quảng Trạch, Lịch sử văn hóa, N/A, N/A
1197. Khu vực: – Bến phà Xuân Sơn – Động Phong Nha, Phong Nha- Bố Trạch, Lịch sử, N/A, KDT Đường Trường Sơn
1198. Làng chiến đấu Cảnh Dương, Quảng Phương- Quảng Trạch, Lịch sử văn hóa, N/A, N/A
1199. Đình Đông Dương, Quảng Lưu & Quảng Thạch- Quảng Trạch, Lịch sử văn hóa, N/A, N/A
1200. Hang Lèn Hà, Hoá Thanh & Hoá Tiến- Minh Hóa, Lịch sử văn hóa, N/A, N/A
1201. Hang động: – Xã Hoá Thanh (hang Thanh Lạng tổng kho X47) – Xã Hoá Tiến (hang Xăng dầu, hang Chỉ huy, hang Hậu cần của Bộ chỉ huy 559), Minh Hóa, Lịch sử, N/A, KDT Đường Trường Sơn
1202. Các trọng điểm trên đường 12A: – Bãi Dinh – Đồi 37,Cha Lo, Cổng Trời… -La Trọng – Ngầm Khe Ve – Ngầm Rinh, Võ Ninh- Quảng Ninh, Lịch sử, N/A, KDT Đường Trường Sơn
1203. Nhà nhóm thôn Trung, Vĩnh Ninh- Quảng Ninh, Lịch sử văn hóa, N/A, N/A
1204. Luỹ Đào Duy Từ (Luỹ Đầu Mâu), Xuân Ninh & Hiền Ninh- Quảng Ninh, Lịch sử văn hóa, N/A, N/A
1205. Bến phà Long Đại, Võ Ninh & Quán Hàu- Quảng Ninh, Lịch sử, N/A, KDT Đường Trường Sơn
1206. Bến phà Quán Hàu, Võ Ninh- Quảng Ninh, Lịch sử văn hóa, N/A, N/A
1207. Lăng mộ Hữu Quân Đô thống Chưởng phủ sự Lê Sỹ, Hiền Ninh- Quảng Ninh, Lịch sử văn hóa, N/A, N/A
1208. Khu vực Sở chỉ huy cơ bản của Bộ Tư lệnh 559: – Hội trường Bộ Tư lệnh – Nhà thờ họ Nguyễn – Nhà thờ họ Trương – Phòng khách Bộ Tư lệnh 559, Lộc Thủy- Lệ Thủy, Lịch sử, N/A, KDT Đường Trường Sơn
1209. Chùa An Xá, Xuân Thủy- Lệ Thủy, Lịch sử văn hóa, N/A, N/A
1210. Chiến thắng Xuân Bồ, Tân Thủy- Lệ Thủy, Lịch sử văn hóa, N/A, N/A
1211. Miếu Thành Hoàng Mỹ Thổ – Trung Lực, Trường Thủy- Lệ Thủy, Lịch sử văn hóa, N/A, N/A
1212. Lăng mộ Nguyễn Hữu Cảnh, Trường Thủy & Phong Thủy- Lệ Thủy, Lịch sử văn hóa, N/A, N/A
1213. Lăng mộ và miếu thờ Hoàng Hối Khanh, Mỹ Thủy- Lệ Thủy, Lịch sử văn hóa, N/A, N/A
1214. Vụ thảm sát Mỹ Trạch, Ngân Thủy- Lệ Thủy, Chứng tích tội ác chiến tranh, N/A, N/A
1215. Trạm thông tin A72, Ngư Thủy Trung- Lệ Thủy, Lịch sử, N/A, KDT Đường Trường Sơn
1216. Trận địa Đại đội nữ Pháo binh Ngư Thủy, Ngư Thủy Trung- Lệ Thủy, , N/A, N/A
1217. Mộ và Nhà thờ Hoàng Kế Viêm, Lương Ninh- Quảng Ninh, Di tích lịch sử, 2023, N/A
1218. Bến đò Tùng Luật, Vĩnh Giang- Vĩnh Linh, Lịch sử cách mạng, 1996, N/A
1219. Khu vực đôi bờ Hiền Lương (bao gồm Cầu Hiền Lương, nhà liên hiệp và đồn công an giới tuyến), Vĩnh Thành- Vĩnh Linh, Lịch sử cách mạng đặc biệt, 1986, đặc biệt 2013 tại 2383/QĐ-TTg
1220. Địa đạo Vĩnh Mốc và Hệ thống làng hầm Vĩnh Linh, Vĩnh Thạch- Vĩnh Linh, Lịch sử cách mạng đặc biệt, 1975, đặc biệt 2014 số 2408/QĐ-TTg
1221. Trận địa tên lửa T5, Nơi bắn rơi máy B52 đầu tiên ở Việt Nam, Bến Quan- Vĩnh Linh, Lịch sử cách mạng, 2010, 3998/QĐ 10/11/2010
1222. Trụ sở Chính phủ Cách mạng lâm thời Cộng hòa miền Nam Việt Nam, Cam Lộ- Cam Lộ, Lịch sử văn hóa, 1991, N/A
1223. Căn cứ Tân Sở, Cam Chính- Cam Lộ, Lịch sử, 1995, N/A
1224. Đình làng Câu Nhi, Hải Tân- Hải Lăng, Lịch sử văn hóa, 2001, N/A
1225. Địa điểm Thảm sát Mỹ Thủy, Hải An- Hải Lăng, Lịch sử, 2001, N/A
1226. Chùa Sắc Tứ, Ái Tử- Triệu Phong, Lịch sử văn hóa, 2009, N/A
1227. Khu lưu niệm Tổng Bí thư Lê Duẩn, Triệu Thành- Triệu Phong, Lịch sử văn hóa, 2010, N/A
1228. Cứ điểm Làng Vây, Tân Long- Hướng Hóa, Lịch sử cách mạng, 2011, N/A
1229. Nhà tù Lao Bảo, Lao Bảo- Hướng Hóa, Lịch sử cách mạng, 1991, N/A
1230. Sân bay Tà Cơn, Tân Hợp- Hướng Hóa, Lịch sử, 1986, N/A
1231. Đình Hà Thượng, thị trấn Gio Linh, Lịch sử văn hóa, 1991, N/A
1232. Địa điểm thảm sát làng Tân Minh (xóm Giữa), Gio Thành- Gio Linh, Lịch sử, 1995, N/A
1233. Hệ thống công trình khai thác nước cổ Gio An (14 Giếng cổ), Gio An- Gio Linh, Khảo cổ văn hóa, 2001, N/A
1234. Căn cứ Dốc Miếu - Cồn Tiên, Gio Phong và Gio An, Lịch sử, 1986, N/A
1235. Các điểm vượt đường 9 của đường dây 559 (bao gồm các cầu Khe Xom, Xom Rò, Du Tiên), Đakrông- Đakrông, Lịch sử đặc biệt, 2013, KDT Đường Trường Sơn
1236. Cầu treo Bến Tắt, Vĩnh Trường- Gio Linh, Lịch sử đặc biệt, 2013, KDT Đường Trường Sơn
1237. Chùa Bảo Đông và bia, môn Trần Đình Ân, Gio Châu- Gio Linh, Lịch sử văn hóa, 1991, N/A
1238. Khu di tích Trận chiến đấu 81 ngày đêm tại Quảng Trị, Bến Quan- Vĩnh Linh, Lịch sử cách mạng đặc biệt, 1986, KDT Trận chiến Quảng Trị, đặc biệt 2013
1239. Thành cổ Quảng Trị, Quảng Trị, Lịch sử kiến trúc đặc biệt, 1986, KDT Trận chiến Quảng Trị
1240. Ngã ba Cầu Ga, Triệu Thượng- Triệu Phong, Lịch sử đặc biệt, 1986, đặc biệt 2013
1241. Ngã ba Long Hưng, Hải Phú- Hải Lăng, Lịch sử đặc biệt, 1986, KDT Trận chiến Quảng Trị
1242. Nhà thờ Long Hưng, Hải Phú- Hải Lăng, Lịch sử đặc biệt, 1986, KDT Trận chiến Quảng Trị
1243. Chốt thép Long Quang, Triệu Trạch- Triệu Phong, Lịch sử đặc biệt, 1986, KDT Trận chiến Quảng Trị
1244. Nhà thờ Tri Bưu, Phường 1- Quảng Trị, Lịch sử đặc biệt, 1986, KDT Trận chiến Quảng Trị
1245. Bến sông Thạch Hãn, Phường 2- Quảng Trị, Lịch sử đặc biệt, 1986, KDT Trận chiến Quảng Trị
1246. Trường Bồ Đề, Phường 2- Quảng Trị, Lịch sử đặc biệt, 1986, KDT Trận chiến Quảng Trị
1247. Chiến khu Ba Lòng, Hải Phúc- Ba Lòng và Triệu Nguyên- Đakrông, Lịch sử, 1999, N/A
1248. Cảng quân sự Đông Hà, Phường 2- Đông Hà, Lịch sử, 1986, N/A
1249. Đình làng Nghĩa An và hệ thống giếng Chăm, Đông Thanh- Đông Hà, Lịch sử, 1996, N/A
1250. Chùa Giác Lương, Phong Hiền- Phong Điền, Lịch sử, 1992, N/A
1251. Mộ Trần Văn Kỷ, Phong Bình- Phong Điền, Lịch sử, 1995, N/A
1252. Mộ Nguyễn Lộ Trạch, Điền Môn- Phong Điền, Lịch sử, 2001, N/A
1253. Nhà thờ và mộ Nguyễn Tri Phương, Phong Chương- Phong Điền, Lịch sử, 1990, N/A
