No.Tên, Địa điểm, Loại di tích, Năm công nhận, Ghi chú
0. null, null, null, null, null
1. Động Tiên Sơn / Động Bình Lư, Bình Lư- Tam Đường, Lịch sử, 1996, N/A
2. Bia Lê Lợi, Lê Lợi- Nậm Nhùn, Lịch sử, 09/02/1981, 10/QĐ-VHTT 
3. Đền thờ vua Lê Lợi, Lê Lợi- Nậm Nhùn, Lịch sử, 23/01/2017, 218/QĐ-BVHTTDL
4. Hang động Pu Sam Cap, Pu Sam Cáp- Sìn Hồ, Danh thắng, 2011, N/A
5. Di chỉ Nậm Tun, Mường So- Phong Thổ, Khảo cổ lịch sử, 2013, N/A
6. Thác Cầu Mây và Đèo Ô Quý Hồ, Tam Đường & Sa Pa, Lịch sử danh thắng, 2015, 2248/QĐDL
7. Chiến trường Điện Biên Phủ, Điện Biên Phủ, Lịch sử đặc biệt, 2009, số 1272/QĐ-TTg
8. Thành Sam Mứn (Tam Vạn), Sam Mứn- Điện Biên, Lịch sử, 22/01/2009, 310/QĐ-BVHTTDL
9. Thành Bản Phủ (Điện Biên), Noong Hẹt- Điện Biên, Lịch sử, 09/02/1981, 10-VHTT/QĐ 
10. Hang Mường Tỉnh, Xa Dung- Điện Biên Đông, Lịch sử, 14/04/2011, 1256/QĐ-BVHTTDL 
11. Nhà tù Lai Châu, Mường Lay, Lịch sử, 2011,  Phế tích
12. Tháp Chiềng Sơ, Chiềng Sơ- Điện Biên Đông, Văn hóa nghệ thuật, 14/04/2011, số 1255/QĐ 
13. Tháp Mường Luân, Mường Luân- Điện Biên Đông, Văn hóa nghệ thuật, 9/02/1981, N/A
14. Động Pa Thơm, Pa Thơm- Điện Biên, Danh thắng, 22/01/2009, N/A
15. Động Xá Nhè (Khó Chua La), Xá Nhè- Tủa Chùa, Danh thắng, 2015, N/A
16. Hang động Pê Răng Ky, Huổi Só- Tủa Chùa, Danh thắng, 2018, N/A
17. Đền Cấm, Phố Mới- Tp. Lào Cai, Lịch sử, 2001, N/A
18. Đền Mẫu Lào Cai, P.Lào Cai- Tp. Lào Cai, Lịch sử, 2011, N/A
19. Đền Thượng Lào Cai, P.Lào Cai- Tp. Lào Cai, Lịch sử, 1996, N/A
20. Đền Trung Đô, Bảo Nhai- Bắc Hà, Lịch sử, 2008, thờ Gia quốc công Vũ Văn Mật
21. Dinh Hoàng A Tưởng, Thị trấn Bắc Hà, Lịch sử, 1999, Lâu đài Hoàng Yến Chao
22. Đồn Phố Ràng, Phố Ràng- Bảo Yên, Lịch sử, 1999, N/A
23. Động Mường Vi, Mường Vi- Bát Xát, Lịch sử, 1999, N/A
24. Động Hàm Rồng, Tung Chung Phố- Mường Khương, Danh thắng, 2003, N/A
25. Bãi đá cổ Sa Pa, Mường Hoa và Tả Van- Sa Pa, Lịch sử, 1994, N/A
26. Ruộng bậc thang Sa Pa, Sa Pa, Danh thắng, 2018, N/A
27. Động Tả Phìn, Tả Phìn- Sa Pa, Danh thắng, 2017, 5388/QĐ-BVHTTDL 
28. Núi Hàm Rồng (Sa Pa), Sa Pa, Lịch sử, 2005, N/A
29. Thành cổ Nghị Lang, Phố Ràng- Bảo Yên, Lịch sử, 2011,  Phế tích
30. Đền Bắc Hà, Thị trấn Bắc Hà, Lịch sử, 2003, N/A
31. Khu căn cứ cách mạng Cam Đường, Cam Đường- Lào Cai, Lịch sử, 1995, N/A
32. Động Thiên Long Bắc Hà, Tả Van Chư- Bắc Hà, Danh thắng, 18/10/2013, số 3579/QĐ
33. Đền Cô Tân An, Tân An- Văn Bàn, Lịch sử văn hóa, 2016, 3743/QĐ 
34. Căng và đồn Nghĩa Lộ, Nghĩa Lộ, Lịch sử, 1996, N/A
35. Chiến khu Vần, Trấn Yên & Văn Chấn, Lịch sử, 1995, N/A
36. Đền Đông Cuông, Đông Cuông- Văn Yên, Lịch sử, 2009, N/A
37. Đền Nhược Sơn, Châu Quế Hạ- Văn Yên, Lịch sử, 2005, N/A
38. Hồ Thác Bà, Lục Yên, Danh thắng, 1996, N/A
39. Khu di tích mộ Nguyễn Thái Học và các chiến sĩ khởi nghĩa Yên Bái, Tp. Yên Bái, Lịch sử, 5/3/1990, 177-VH/QĐ
40. Ruộng bậc thang Mù Cang Chải, Mù Cang Chải, Danh thắng, 2007, đặc biệt 2020
41. Đèo Lũng Lô, Văn Chấn & Phù Yên, Lịch sử, 2012, N/A
42. Địa điểm Khu Ủy Tây Bắc, Phù Nham- Văn Chấn, Lịch sử, 2012, N/A
43. Bến Âu Lâu, Tp. Yên Bái, Lịch sử, 2012, N/A
44. Nơi thành lập đội du kích Khau Phạ, Mù Cang Chải, Lịch sử, 2012, 3270/QĐ
45. Chùa tháp Hắc Y, Tân Lĩnh- Lục Yên, Lịch sử kiến trúc, 2001, N/A
46. Lễ đài Sân vận động Yên Bái, Tp. Yên Bái, Lịch sử, 1989, Nơi tưởng niệm Chủ tịch Hồ Chí Minh
47. Đồn cổ Đại Lịch, Đại Lịch- Văn Chấn, Lịch sử, 2012, N/A
48. Nhà tù Sơn La, Tp. Sơn La, Lịch sử đặc biệt, 1962 31/12/2014, đặc biệt 2408/QĐ-TTg
49. Tập đoàn cứ điểm Nà Sản, Chiềng Mung- Mai Sơn, Lịch sử, 24/01/1998, 95/QĐ
50. Đồn Mộc Lỵ, Mường Sang- Mộc Châu, Lịch sử, 24/01/1998, 95/QĐ
51. Khu di tích lịch sử Cách mạng Việt Nam - Lào, Phiêng Khoài- Yên Châu, Lịch sử văn hóa, 03/4/2012, 1240/QĐ
52. Thẳm Tát Tòng (Hang Tát Toòng), Tp. Sơn La, Danh thắng, 05/02/1994, N/A
53. Động Sơn Mộc Hương (Hang Dơi), Thị trấn Mộc Châu, Danh thắng, 24/01/1998, 95/QĐ
54. Hồ Chiềng Khoi, Chiềng Khoi- Yên Châu, Danh thắng, 28/12/2001, 53/2001/QĐ
55. Kỳ đài Thuận Châu, Thị trấn Thuận Châu, Lịch sử, 20/4/1995, 1568/QĐ-BT
56. Ngã ba Cò Nòi, Cò Nòi- Mai Sơn, Lịch sử, 29/4/2004, 16/2004/QĐ
57. Bia Quế Lâm Ngự Chế, năm 1440, Chiềng Lề- Tp. Sơn La, Lịch sử, 05/02/1994, 226/QĐ-BT 
58. Tháp Mường Và, Mường Và- Sốp Cộp, Văn hóa nghệ thuật, 24/01/1998, 95/1998/QĐ 
59. Tháp Mường Bám, Mường Bám- Thuận Châu, Lịch sử văn hóa, 24/10/2012, 4064/QĐ
60. Hang mộ Tạng Mè, Suối Bàng- Mộc Châu, Lịch sử khảo cổ, 05/3/2014, 523/QĐ
61. Bãi đá khắc cổ Khe Hổ, Hang Chú- Bắc Yên, Lịch sử khảo cổ, 12/12/2014, 4107/QĐ
62. Khu tưởng Chủ tịch Hồ Chí Minh tại Nhà máy in tiền - Đồn điền Chi Nê, Chi Nê- Lạc Thủy, Lịch sử, 2007, N/A
63. Quần thể Chùa Tiên, Phú Lão- Lạc Thủy, Khảo cổ, 1989, N/A
64. Hang Luồn Chi Nê / hang Trinh Nữ, Chi Nê- Lạc Thủy, Lịch sử, 2001, N/A
65. Hang Đồng Thớt, Ba Hàng Đồi- Lạc Thủy, Khảo cổ, 2003, N/A
66. Động Núi Niệm, Phú Thành- Lạc Thủy, Lịch sử khảo cổ danh thắng, 2013, N/A
67. Khu Mộ cổ Đống Thếch, Vĩnh Đồng- Kim Bôi, Lịch sử, 1997, N/A
68. Căn cứ cách mạng Cao Phong - Thạch Yên, Yên Lập- Cao Phong, Lịch sử, 1996, N/A
69. Tượng đài Anh hùng Cù Chính Lan, Bình Thanh- Cao Phong, Lịch sử, 1994, N/A
70. Tp. Hòa Bình, Lịch sử, N/A, N/A, 
71. Động Tiên Phi, Tân Hòa- Tp. Hòa Bình, Danh thắng, 2000, N/A
72. Động Thác Bờ (Đền Chúa Thác Bờ), Vầy Nưa- Đà Bắc, Danh thắng, 2009, N/A
73. Động Hoa Tiên, Ngòi Hoa-Tân Lạc, Danh thắng, 2003, N/A
74. Động Thiên Long Yên Thủy, Lạc Lương- Yên Thủy, Danh thắng, 2003, N/A
75. Hang Chùa, Yên Thủy, Yên Trị- Yên Thủy, Danh thắng, N/A, N/A
76. Hang Chổ, Cao Sơn- Lương Sơn, Danh thắng, N/A, N/A
77. Căng Bắc Mê, Yên Cường- Bắc Mê, Lịch sử, 1992, N/A
78. Chùa Nậm Dầu, Ngọc Linh- Vị Xuyên, Khảo cổ, 2009, N/A
79. Cột cờ Lũng Cú, Lũng Cú- Đồng Văn, Lịch sử, 2009, N/A
80. Tiểu khu Trọng Con, Bằng Hành- Bắc Quang, Lịch sử, 1996, N/A
81. Phố cổ Đồng Văn, Tt. Đồng Văn, Văn hóa nghệ thuật, 2009, N/A
82. Hang Nà Luông, Yên Minh & Đồng Văn, Danh thắng, 23/9/2014, 3087/QĐ-BVHTTDL
83. Ruộng bậc thang Hoàng Su Phì, Hoàng Su Phì, Danh thắng, 2011, N/A
84. Núi Đôi Quản Bạ, Tt. Quản Bạ, Danh thắng, 2010, N/A
85. Kỳ đài Quảng trường 26/3, Tp. Hà Giang, Lịch sử, 1993, N/A
86. Dinh thự họ Vương (Dinh vua Mèo), Sà Phìn- Đồng Văn, Văn hóa nghệ thuật, 1993, N/A
87. Bãi đá cổ Nấm Dẩn, Nấm Dẩn- Xín Mần, Khảo cổ, 2008, N/A
88. Đèo Mã Pí Lèng, Mèo Vạc & Đồng Văn, Danh thắng, 16/11/2009, 4194/QĐ-BVHTTDL
89. Hang Rồng, Tà Lủng & Pả Vi, Mèo Vạc, Danh thắng, 23/9/2014, 3088/QĐ-BVHTTDL
90. Thác Tiên Đèo Gió, Nấm Dẩn- Xín Mần, Danh thắng, 2009, N/A
91. Bia Sùng Khánh và Chuông Bình Lâm, Phú Linh- Vị Xuyên, Lịch sử, 1993, N/A
92. Hang Đán Cúm - Nà Chảo, Yên Cường- Bắc Mê, Khảo cổ, 2001, N/A
93. Hang Khố Mỷ, Tùng Vài- Quản Bạ, Danh thắng, 2013, N/A
94. Hang Thiên Thủy, Nàn Ma- Xín Mần, Danh thắng, 2013, N/A
95. Hang Khâu Đôn, Đức Xuân- Bắc Quang, Danh thắng, 07/01/2020, 45/QĐ-BVHTTDL 
96. Hang Nậm Tan, Đức Xuân- Bắc Quang, Danh thắng, 07/01/2020, 45/QĐ-BVHTTDL 
97. Thác Nậm Tạu, Đức Xuân- Bắc Quang, Danh thắng, 2018, N/A
98. Khu vực Hóa thạch Huệ Biển, Lũng Pù- Mèo Vạc, Khảo cổ danh thắng, 23/9/2014, 3087/QĐ-BVHTTDL
99. Khu vực Hóa thạch Tay Cuộn, Ma Lé- Đồng Văn, Khảo cổ danh thắng, 12/11/2013, N/A
100. Thác Luồng, Nà Chì- Xín Mần, Danh thắng, 2021, N/A
101. Thác Trăn, Khuôn Lùng- Xín Mần, Danh thắng, 2021, N/A
102. Địa điểm Chiến thắng Biên giới năm 1950, Thạch An, Lịch sử cách mạng đặc biệt, 2017, 2082/QĐ-TTg
103. Hồ Thang Hen, Quốc Toản-Trà Lĩnh, Danh thắng, 2001, N/A
104. Khu lưu niệm Kim Đồng và nơi thành lập đội Nhi đồng Cứu Quốc, Trường Hà- Hà Quảng, Lịch sử, 2011, N/A
105. Chuông chùa Đà Quận, Tp. Cao Bằng, Văn hóa nghệ thuật, 1995, N/A
106. Đền vua Lê, Hoàng Tung- Hòa An, Lịch sử, 1995, N/A
107. Đề Thám, Tp. Cao Bằng, Lịch sử, N/A, N/A, 1988
108. Địa điểm Nà Ngần, Hoa Thám- Nguyên Bình, Lịch sử, 1994, N/A
109. Nậm Lìn, Hoàng Tung- Hòa An, Lịch sử, 1995, N/A
110. Hang Ngườm Bốc, Hồng Việt- Hòa An, Lịch sử, 2004, 02/2004/QĐ-BVHTT
111. Động Ngao (Ngườm Ngao), Đàm Thủy- Trùng Khánh, Danh thắng, 1998, N/A
112. Hang Kéo Quảng, Minh Tâm- Nguyên Bình, Lịch sử, 1995, N/A
113. Nơi Chủ tịch Hồ Chí Minh ở và làm việc đầu năm 1942, Hòa An, Lịch sử, 1995, N/A
114. Nơi thành lập Đội Việt Nam Tuyên truyền Giải phóng quân ngày 22/12/1944, Rừng Trần Hưng Đạo Tam Kim- Nguyên Bình, Lịch sử đặc biệt, 2013, 2383/QĐ-TTg
115. Thác Bản Giốc, Đàm Thủy- Trùng Khánh, Danh thắng, 1998, N/A
116. Thành Na Lữ, Hoàng Tung- Hòa An, Lịch sử, 2009, N/A
117. Khu di tích Pác Bó, Trường Hà- Hà Quảng, Lịch sử đặc biệt, 2012, 548/QĐ-TTg 
118. Di tích lịch sử Chi Lăng, Chi Lăng, Lịch sử đặc biệt, 1962, đặc biệt 2020
119. Hang Gió Chi Lăng, Chi Lăng, Khảo cổ, 23/08/2004, 77/2004/QĐ-BVHTT 
120. Hang Lạng Nắc, Chi Lăng, Khảo cổ, 23/08/2004, 77/2004/QĐ-BVHTT
121. Hang Phia Điểm, Cao Lộc, Khảo cổ, 23/08/2004, 77/2004/QĐ-BVHTT
122. Hang Dơi Bắc Sơn, Vũ Lễ- Bắc Sơn, Khảo cổ, 23/08/2004, 77/2004/QĐ-BVHTT
123. Hang Thẩm Khuyên, Bình Gia, Khảo cổ, 1993, N/A
123. Hang Thẩm Khuyên, Bình Gia, Khảo cổ, 1993, N/A
124. Động Nhị Thanh - Chùa Tam Thanh, Lạng Sơn, Lịch sử, 1962, số 313-VH/VP
125. Di tích Khởi nghĩa Bắc Sơn, Bắc Sơn, Lịch sử đặc biệt, 2016, 13 di tích quốc gia, 2499/QĐ-TTg
126. Địa điểm ghi dấu tội ác của thực dân Pháp tại Lân Áng (09/02/1945), Hưng Vũ- Bắc Sơn, Lịch sử, 2020, N/A
127. Địa điểm ghi dấu tội ác của thực dân Pháp tại Minh Đán (01/10/1940), Hưng Vũ- Bắc Sơn, Lịch sử, 2020, N/A
128. Linh địa cổ Mẫu Sơn, Lộc Bình, Khảo cổ, 2013, N/A
129. Núi Tô Thị, Lạng Sơn, Danh thắng, 1962, N/A
130. Khu di tích núi Phai Vệ, Lạng Sơn, Khảo cổ, 23/08/2004, 77/2004/QĐ-BVHTT
131. Đền Kỳ Cùng, Lạng Sơn, Lịch sử, 1993, N/A
132. Lạng Sơn, Văn hóa nghệ thuật, N/A, N/A, 
133. Thành cổ Lạng Sơn, Lạng Sơn, Văn hóa nghệ thuật, 1999, N/A
134. Chùa Thành, Lạng Sơn, Lịch sử, 1993, N/A
135. Hang Cốc Mười, Tràng Định, Lịch sử, 23/08/2004, 77/2004/QĐ-BVHTT
136. Di tích kiến trúc nghệ thuật đền Cửa Đông, Cửa Tây, Cửa Nam, Cửa Bắc, P.Chi Lăng- Tp. Lạng Sơn, Lịch sử văn hóa, 12/11/2013, N/A
137. Đền Cửa Ông, Cẩm Phả, Lịch sử, 1989, đặc biệt 2017 tại 2082/QĐ-TTg
138. Cụm di tích Xí nghiệp Tuyển than Cửa Ông, Cẩm Phả, Lịch sử, 1997, N/A
139. Ngã tư đường lên mỏ Đèo Nai, Cẩm Phả, Lịch sử, 1997, Cẩm Tây
140. Khu di tích lưu niệm Chủ tịch Hồ Chí Minh trên đảo Cô Tô, Cô Tô, Lịch sử, 1997, N/A
141. Khu di tích nhà Trần tại Đông Triều, Đông Triều, Lịch sử đặc biệt, 1962, đặc biệt 2013 tại 2383/QĐ-TTg
142. Chùa Hồ Thiên, thuộc Khu di tích nhà Trần, Đông Triều, Lịch sử văn hóa, 2006, N/A
143. Chùa Quỳnh Lâm, Đông Triều, Đông Triều, Văn hóa nghệ thuật, 1991, N/A
144. Chùa Mỹ Cụ, Đông Triều, Văn hóa nghệ thuật, 2000, N/A
145. Khu di tích Hổ Lao, Đông Triều, Văn hóa nghệ thuật, 2001, N/A
146. Chùa Cảnh Huống, Đông Triều, Lịch sử văn hóa, 1993, Cụm di tích xã Yên Đức
147. Chùa Ngọa Vân, Đông Triều, Lịch sử văn hóa, 2006, N/A
148. Đệ tứ chiến khu Đông Triều, Đông Triều, Lịch sử, 1994, N/A
149. Đền An Biên, Thủy An- Đông Triều, Lịch sử văn hóa, 2017, 808/QĐ
150. Đền Quan Đại, Quảng Yên, Lịch sử văn hóa, 2014, N/A
151. Miếu Tiên Công Cẩm La, Quảng Yên, Lịch sử văn hóa, 1990, N/A
152. Đình Lưu Khê, Quảng Yên, Văn hóa nghệ thuật, 1995, N/A
153. Chùa Yên Đông, Quảng Yên, Văn hóa nghệ thuật, 2000, N/A
154. Miếu Tiên Công, Liên Hòa, Quảng Yên, Lịch sử, 2001, N/A
155. Nhà thờ họ Vũ (Vũ Tam Tỉnh), Quảng Yên, Lịch sử văn hóa, 2001, N/A
156. Nhà thờ họ Nguyễn (Nguyễn Thực, Nguyễn Nghệ), Quảng Yên, Lịch sử văn hóa, 2001, N/A
157. Nhà thờ họ Dương (Dương Quang Tín), Quảng Yên, Lịch sử văn hóa, 2001, N/A
158. Nhà thờ họ Hoàng (Hoàng Kim Bảng), Quảng Yên, Lịch sử văn hóa, 2001, N/A
159. Nhà thờ họ Bùi (Bùi Bách Niên), Quảng Yên, Lịch sử văn hóa, 2001, N/A
160. Nhà thờ họ Vũ (Vũ Song), Quảng Yên, Lịch sử văn hóa, 2001, N/A
161. Nhà thờ họ Đỗ (Đỗ Độ), Quảng Yên, Lịch sử văn hóa, 2001, N/A
162. Nhà thờ họ Đào (Đào Bá Lệ), Quảng Yên, Lịch sử văn hóa, 2001, N/A
163. Nhà thờ họ Lê (Lê Mở, Lê Khép), Quảng Yên, Lịch sử văn hóa, 2001, N/A
164. Nhà thờ họ Phạm (Cụm di tích Tiên Công), Quảng Yên, Lịch sử, 2012, N/A
165. Di tích khảo cổ núi Đầu Rằm, Quảng Yên, Khảo cổ, 2012, N/A
166. Đình Đền Công - Miếu Cu Linh, Uông Bí, Lịch sử đặc biệt, 2000, N/A
167. Quần thể di tích danh thắng Yên Tử, Uông Bí, Lịch sử đặc biệt, 1974, đặc biệt 2012 tại 1419/QĐ-TTg
168. Di tích thương cảng Vân Đồn (Cống Đông, Tây và Bến Cái Làng), Vân Đồn, Lịch sử, 2003, N/A
169. Đình Quan Lạn, Vân Đồn, Văn hóa nghệ thuật, 1999, N/A
170. Cụm di tích và danh thắng núi Bài Thơ - Chùa Long Tiên - Đền Đức Ông, Hạ Long, Danh thắng, 1992, N/A
171. Trận địa pháo 37 li của Xí nghiệp tuyển than Hòn Gai, Hạ Long, Lịch sử, 1997, N/A
172. Vịnh Hạ Long, Hạ Long, Danh thắng, 1962, đặc biệt 2009, số 1272/QĐ-TTg
173. Hạ Long, Danh thắng, N/A, N/A, 
174. Di chỉ Hòn Hai Cô Tiên, Hạ Long, Khảo cổ, 2005, N/A
175. Trung tâm Điện chính Bưu điện Quảng Ninh trên núi Bài Thơ, Hạ Long, Lịch sử, 2000, N/A
176. Chùa Nam Thọ, Móng Cái, Văn hóa nghệ thuật, 1999, N/A
177. Đình Trà Cổ, Móng Cái, Văn hóa nghệ thuật, 1974, N/A
178. Chùa Xuân Lan, Móng Cái, Văn hóa nghệ thuật, 1999, N/A
179. Núi Mằn, Hoành Bồ, Danh thắng, 2014, N/A
180. Đình Phong Cốc, Quảng Yên, Văn hóa kiến trúc đặc biệt, 1988, N/A
181. Khu Di tích chiến thắng Bạch Đằng, Quảng Yên & Uông Bí, Lịch sử văn hóa đặc biệt, 2012, KDT Bạch Đằng. 1419/QĐ-TTg
182. Bãi cọc Yên Giang, Nam Hòa- Quảng Yên, Lịch sử đặc biệt, 1988, KDT Bạch Đằng
183. Cây lim Giếng Rừng, Quảng Yên, Lịch sử đặc biệt, 1998, KDT Bạch Đằng
184. Đền Trần Hưng Đạo - Miếu Vua Bà, Quảng Yên, Lịch sử đặc biệt, 1989, KDT Bạch Đằng
185. Đình Trung Bản, Quảng Yên, Lịch sử đặc biệt, 1991, KDT Bạch Đằng
186. Đình Yên Giang, Quảng Yên, Lịch sử đặc biệt, 1996, KDT Bạch Đằng
187. Đền Trung Cốc, Quảng Yên, Lịch sử đặc biệt, 1996, KDT Bạch Đằng
188. Địa điểm lưu niệm Chủ tịch Hồ Chí Minh trên đảo Ngọc Vừng, Ngọc Vừng- Quan Lạn, Di tích lịch sử, 2023, N/A
189. Lán ở và làm việc của Chủ tịch Hồ Chí Minh, Trung Trực- Yên Sơn, Lịch sử, 2015, số 2251/QĐDL
190. Yên Sơn, Lịch sử, N/A, N/A, 
191. Đền Hạ Tuyên Quang, Tuyên Quang, Lịch sử, kiến trúc, 1991, N/A
192. Đền Thượng Tuyên Quang, Tràng Đà- Tp. Tuyên Quang, Lịch sử, 2015, số 2250/QĐDL
193. Đền Ỷ La, Tp. Tuyên Quang, Lịch sử, 2015, số 2249/QĐDL
194. Thành nhà Mạc (Tuyên Quang), Tuyên Quang, Lịch sử, 1991, Năm 2010 đã phá cũ, xây cái mới khác
195. Di tích Nha Công an Trung ương, Sơn Dương, Lịch sử, 1999, N/A
196. Chiến khu Tân Trào. Gồm 40 di tích quốc gia, Sơn Dương & Yên Sơn, Lịch sử đặc biệt, N/A, đặc biệt 2012
197. Khu bảo tồn thiên nhiên Na Hang - Lâm Bình, Na Hang & Lâm Bình, Danh thắng đăc biệt, 2018, N/A
198. Thác Bản Ba, Trung Hà- Chiêm Hóa, Danh thắng, 2007, N/A
199. Hang Phia Vài, Lâm Bình, Khảo cổ, 2009, N/A
200. Động Song Long, Khuôn Hà- Na Hang, Danh thắng, 2009, N/A
201. Hang Phia Muồn, Na Hang, Khảo cổ, 2009, N/A
202. Đền Pác Tạ, Na Hang, Lịch sử, 2009, N/A
203. Chùa Phúc Lâm (Na Hang), Thượng Lâm- Na Hang, Lịch sử, 2009, N/A
204. Cơ quan Ấn loát đặc biệt Trung ương, Năng Khả- Na Hang, Lịch sử, 2009, N/A
205. Thắng cảnh Thượng Lâm, Na Hang, Danh thắng, 2009, N/A
206. Xưởng Quân khí H52 và địa điểm sản xuất diêm tiêu, Na Hang, Lịch sử, 2009, N/A
207. Thác Nậm Me, Na Hang, Danh thắng, 2009, N/A
208. Tt. Na Hang, Na Hang, Danh thắng, N/A, N/A, 
209. Địa điểm Nha Ngân khố - Tín dụng, Tứ Quận- Yên Sơn, Lịch sử, 2018, N/A
210. Địa điểm chùa Lang Đạo, Tú Thịnh- Sơn Dương, Khảo cổ, 2018, N/A
211. Yên Phú, Hàm Yên, Danh thắng, N/A, N/A, 
212. Hang Đá Đen, Yên Phú- Hàm Yên, Khảo cổ, 2018, N/A
213. Thác Lụa, Hòa Phú- Chiêm Hóa, Danh thắng, 2018, N/A
214. Địa điểm cơ quan Ban Nông vận Trung ương và Hội Nông dân cứu quốc Trung ương (1949-1952), Điềm Mặc- Định Hóa, Lịch sử, 2020, N/A
215. Địa điểm cơ quan Tổng bộ Việt Minh (1947-1948) và Nơi làm việc của đồng chí Hoàng Quốc Việt (1947-1950), Điềm Mặc- Định Hóa, Lịch sử, 2020, N/A
216. Địa điểm thành lập Tổng cục cung cấp (11/7/1950), Thanh Định- Định Hóa, Lịch sử, 2015, số 2246/QĐDL
217. Nơi ở và làm việc của Đại tướng Võ Nguyên Giáp tại Keo En (1953-1954), Thanh Định- Định Hóa, Lịch sử văn hóa, 2017, số 809/QĐ
218. Nơi làm việc của Bộ Tổng tham mưu Quân đội Nhân dân Việt Nam (1949-1954), Bảo Linh- Định Hóa, Lịch sử, 2015, số 2245/QĐDL
219. Xưởng Đội Cấn - Nhà máy quân giới K77 (1947-1954), Đồng Thịnh- Định Hóa, Lịch sử văn hóa, 2017, số 813/QĐ
220. Địa điểm cơ quan Bộ Tổng tham mưu Quân đội nhân dân Việt Nam và Nơi ở, làm việc của Tổng tham mưu trưởng Hoàng Văn Thái (1949-1954), Định Biên- Định Hóa, Lịch sử văn hóa, 2017, số 814/QĐ
221. An toàn khu Định Hóa (gồm 13 di tích thành phần), Định Hóa, Lịch sử đặc biệt, 1981, đặc biệt 2012
222. Di tích Nhà tù Chợ Chu, Định Hóa, Lịch sử đặc biệt, N/A, ATK Định Hóa
223. Nơi thành lập Việt Nam Giải phóng quân, Định Hóa, Lịch sử đặc biệt, N/A, ATK Định Hóa
224. Nơi Chủ tịch Hồ Chí Minh ở và làm việc tại đồi Khau Tý năm 1947, Định Hóa, Lịch sử đặc biệt, N/A, ATK Định Hóa
225. Địa điểm Bác ở và làm việc tại Đồi Tỉn Keo (1948 - 1954), Định Hóa, Lịch sử đặc biệt, N/A, ATK Định Hóa
226. Cụm di tích Bác ở Khuôn Tát, Định Hóa, Lịch sử đặc biệt, N/A, ATK Định Hóa
227. Địa điểm Tổng Bí thư Trường Chinh và Văn phòng Trung ương Đảng ở Phông Hiển (1947 -1949), Định Hóa, Lịch sử đặc biệt, N/A, ATK Định Hóa
228. Địa điểm cơ quan Bộ tổng Tư lệnh Quân đội nhân dân Việt Nam (1949-1954), Định Hóa, Lịch sử đặc biệt, N/A, ATK Định Hóa
229. Thắng cảnh Thác Khuôn Tát, Định Hóa, Lịch sử đặc biệt, N/A, ATK Định Hóa
230. Địa điểm thành lập Hội Nhà báo Việt Nam, Định Hóa, Lịch sử đặc biệt, N/A, ATK Định Hóa
231. Địa điểm thành lập Ủy ban Hòa bình Việt Nam (Ủy ban bảo vệ hòa bình thế giới của Việt Nam), Định Hóa, Lịch sử đặc biệt, N/A, ATK Định Hóa
232. Định Hóa, Lịch sử đặc biệt, N/A, N/A, 
233. Địa điểm Báo Quân đội nhân dân ra số đầu 20/10/1950, Định Hóa, Lịch sử đặc biệt, N/A, ATK Định Hóa
234. Địa điểm Đồi Pụ Đồn, nơi Chủ tịch Hồ Chí Minh chủ trì lễ phong quân hàm Đại tướng Tổng chỉ huy quân đội quốc gia và dân quân tự vệ cho đồng chí Võ Nguyên Giáp (1948), Định Hóa, Lịch sử đặc biệt, N/A, ATK Định Hóa
235. Định Hóa, Lịch sử, N/A, N/A, 
236. Danh lam thắng cảnh Chùa Hang, Định Hóa, Danh thắng, 2015, N/A
237. Định Hóa, Lịch sử, N/A, N/A, 
238. Định Hóa, Lịch sử, N/A, N/A, 
239. Định Hóa, Lịch sử, N/A, N/A, 
240. Phú Bình, Lịch sử, N/A, N/A, 
241. Phú Bình, Văn hóa nghệ thuật, N/A, N/A, 
242. Phú Bình, Văn hóa nghệ thuật, N/A, N/A, 
243. Phú Bình, Văn hóa nghệ thuật, N/A, N/A, 
244. Phú Bình, Văn hóa nghệ thuật, N/A, N/A, 
245. Phú Bình, Văn hóa nghệ thuật, N/A, N/A, 
246. Phú Bình, Lịch sử, N/A, N/A, 
247. Tiên Phong, Phổ Yên, Lịch sử, N/A, N/A, 
248. Phổ Yên, Lịch sử, N/A, N/A, 
249. Chùa Tây Phúc, Phổ Yên, Văn hóa nghệ thuật, 2007, N/A
250. Phổ Yên, Lịch sử, N/A, N/A, 
251. Đại Từ, Lịch sử, N/A, N/A, 
252. Khu di tích Núi Văn - Núi Võ, Đại Từ, Lịch sử, 09/02/1981, 10-VHTT/QĐ 
253. Nơi thành lập cơ sở Đảng Cộng sản đầu tiên của Đảng bộ tỉnh Thái Nguyên năm 1936, Đại Từ, Lịch sử, 1999, N/A
254. Địa điểm thành lập cơ quan chỉ huy Chiến khu Nguyễn Huệ, Đại Từ, Lịch sử, 1999, N/A
255. Nơi làm việc của Chủ tịch Hồ Chí Minh (1954) tại đồi Thành Trúc, Đại Từ, Lịch sử, 2006, N/A
256. Đại Từ, Lịch sử, N/A, N/A, 
257. Địa điểm lễ nhận Quốc thư đầu tiên của Nước Việt Nam Dân Chủ Cộng Hòa (01/9/1954), Tiên Hội- Đại Từ, Lịch sử, 2018, N/A
258. Thái Nguyên, Lịch sử, N/A, N/A, 
259. Thái Nguyên, Lịch sử, N/A, N/A, 
260. Thái Nguyên, Lịch sử, N/A, N/A, 
261. Thái Nguyên, Lịch sử, N/A, N/A, 
262. Đồng Hỷ, Danh thắng, N/A, N/A, 
263. Động Linh Sơn, Đồng Hỷ, Danh thắng, 1999, N/A
264. Phú Lương, Lịch sử, N/A, N/A, 
265. Phú Lương, Lịch sử, N/A, N/A, 
266. Phú Lương, Lịch sử, N/A, N/A, 
267. Võ Nhai, Khảo cổ, N/A, N/A, 
268. Hang Ốc, Bình Long- Võ Nhai, Khảo cổ, 2018, N/A
269. Võ Nhai, Lịch sử, N/A, N/A, 
270. Võ Nhai, Danh thắng, N/A, N/A, 
271. Hang Sa Khao, Võ Nhai, Danh thắng, N/A, N/A
272. Địa điểm thành lập Đội Thanh niên xung phong công tác Trung ương (15/7/1950), Yên Lãng- Đại Từ, Di tích lịch sử, N/A, N/A
273. Địa điểm hoạt động của Ban Giao thông Liên lạc Trung ương (1947 - 1954), Bình Thành- Định Hóa, Di tích lịch sử, N/A, N/A
274. Hang Nà Mò, Hiệp Lực- Ngân Sơn, Khảo cổ, 7/1/2020, 42/QĐ-BVHTTDL
275. Hoàng Phài - Địa điểm Lưu niệm nơi Bác Hồ dừng chân trên đường từ Pác Bó về Tân Trào, 5/1945, Ngân Sơn, Lịch sử, 2011, N/A
276. Ngân Sơn, Lịch sử, N/A, N/A, 
277. Di tích lịch sử Nà Tu, Bạch Thông, Lịch sử, 1996, N/A
278. Đồn Phủ Thông, Bạch Thông, Lịch sử, 1998, N/A
279. ATK Chợ Đồn, Chợ Đồn, Lịch sử đặc biệt, 2016, 2499/QĐ-TTg 
280. Bản Ca, Chợ Đồn, Lịch sử, 1996, ATK Chợ Đồn
281. Đồi Nà Pậu - Nơi làm việc của Hồ Chủ tịch đầu năm 1951, Chợ Đồn, Lịch sử, 1996, ATK Chợ Đồn
282. Khuổi Linh - Nơi làm việc của đồng chí Trường Chinh và văn phòng Trung ương Đảng năm 1950, Chợ Đồn, Lịch sử, 1996, ATK Chợ Đồn
283. Bản Bằng, Chợ Đồn, Lịch sử, 1996, ATK Chợ Đồn
284. Đồi Khau Mạ - Nơi làm việc của Đồng chí Phạm Văn Đồng (1950 - 1951), Chợ Đồn, Lịch sử, 1996, ATK Chợ Đồn
285. Di tích lịch sử Nà Quân, Chợ Đồn, Lịch sử, 1996, ATK Chợ Đồn
286. Động Nàng Tiên, Lương Hạ- Na Rì, Danh thắng, 1999, N/A
